<questions xmlns="urn:Test.Namespace"
           xmlns:xsi="http://www.w3.org/2001/XMLSchema-instance"
           xsi:schemaLocation="urn:Test.Namespace file:///D:\projects\question-game\db\src\main\resources\pl\db\schema.xsd">

    <question>
        <content>Who delivered the less famous two-hour speech that preceded Abraham Lincoln's two-minute Gettysburg Address?</content>
        <answer1>Ipsum Lorem IpsumLorem IpsumLorem Ipsum Lorem IpsumLorem IpsumLorem Ipsum Lorem IpsumLorem IpsumLorem </answer1>
        <answer2>DDDDDDDDDDDDDDDDDDDDDDDDDDDDDDDDDDDDDDDDDDDDDDDDDDDDDDDDDDDDDDDDDDDDDDDDDDDDDDDDDDDDDDDDDDDDDDDDDDDDDDDDDDDDDDD</answer2>
        <answer3>YYYYYYYYYYYYYYYYYYYYYYYYYYYYYYYYYYYYYYYYYYYYYYYYYYYYYYYYYYYYYYYYYYYYYYYYYYYYYYYYYYYYYYYYYYYYYYYYYYYYYYYYYY</answer3>
        <answer4>1000</answer4>
        <correctAnswer>1000</correctAnswer>
    </question>

    <question>
        <content>Who delivered the less famous two-hour speech that preceded Abraham Lincoln's two-minute Gettysburg Address?</content>
        <answer1>Ipsum Lorem IpsumLorem IpsumLorem Ipsum Lorem IpsumLorem IpsumLorem Ipsum Lorem IpsumLorem IpsumLorem </answer1>
        <answer2>DDDDDDDDDDDDDDDDDDDDDDDDDDDDDDDDDDDDDDDDDDDDDDDDDDDDDDDDDDDDDDDDDDDDDDDDDDDDDDDDDDDDDDDDDDDDDDDDDDDDDDDDDDDDDDD</answer2>
        <answer3>YYYYYYYYYYYYYYYYYYYYYYYYYYYYYYYYYYYYYYYYYYYYYYYYYYYYYYYYYYYYYYYYYYYYYYYYYYYYYYYYYYYYYYYYYYYYYYYYYYYYYYYYYY</answer3>
        <answer4>1000</answer4>
        <correctAnswer>1000</correctAnswer>
    </question>


    <question>
        <content>Who delivered the less famous two-hour speech that preceded Abraham Lincoln's two-minute Gettysburg Address?</content>
        <answer1>Ipsum Lorem IpsumLorem IpsumLorem Ipsum Lorem IpsumLorem IpsumLorem Ipsum Lorem IpsumLorem IpsumLorem </answer1>
        <answer2>DDDDDDDDDDDDDDDDDDDDDDDDDDDDDDDDDDDDDDDDDDDDDDDDDDDDDDDDDDDDDDDDDDDDDDDDDDDDDDDDDDDDDDDDDDDDDDDDDDDDDDDDDDDDDDD</answer2>
        <answer3>YYYYYYYYYYYYYYYYYYYYYYYYYYYYYYYYYYYYYYYYYYYYYYYYYYYYYYYYYYYYYYYYYYYYYYYYYYYYYYYYYYYYYYYYYYYYYYYYYYYYYYYYYY</answer3>
        <answer4>1000</answer4>
        <correctAnswer>1000</correctAnswer>
    </question>


    <question>
        <content>Who delivered the less famous two-hour speech that preceded Abraham Lincoln's two-minute Gettysburg Address?</content>
        <answer1>Ipsum Lorem IpsumLorem IpsumLorem Ipsum Lorem IpsumLorem IpsumLorem Ipsum Lorem IpsumLorem IpsumLorem </answer1>
        <answer2>DDDDDDDDDDDDDDDDDDDDDDDDDDDDDDDDDDDDDDDDDDDDDDDDDDDDDDDDDDDDDDDDDDDDDDDDDDDDDDDDDDDDDDDDDDDDDDDDDDDDDDDDDDDDDDD</answer2>
        <answer3>YYYYYYYYYYYYYYYYYYYYYYYYYYYYYYYYYYYYYYYYYYYYYYYYYYYYYYYYYYYYYYYYYYYYYYYYYYYYYYYYYYYYYYYYYYYYYYYYYYYYYYYYYY</answer3>
        <answer4>1000</answer4>
        <correctAnswer>1000</correctAnswer>
    </question>


    <question>
        <content>Who delivered the less famous two-hour speech that preceded Abraham Lincoln's two-minute Gettysburg Address?</content>
        <answer1>Ipsum Lorem IpsumLorem IpsumLorem Ipsum Lorem IpsumLorem IpsumLorem Ipsum Lorem IpsumLorem IpsumLorem </answer1>
        <answer2>DDDDDDDDDDDDDDDDDDDDDDDDDDDDDDDDDDDDDDDDDDDDDDDDDDDDDDDDDDDDDDDDDDDDDDDDDDDDDDDDDDDDDDDDDDDDDDDDDDDDDDDDDDDDDDD</answer2>
        <answer3>YYYYYYYYYYYYYYYYYYYYYYYYYYYYYYYYYYYYYYYYYYYYYYYYYYYYYYYYYYYYYYYYYYYYYYYYYYYYYYYYYYYYYYYYYYYYYYYYYYYYYYYYYY</answer3>
        <answer4>1000</answer4>
        <correctAnswer>1000</correctAnswer>
    </question>


    <question>
        <content>Who delivered the less famous two-hour speech that preceded Abraham Lincoln's two-minute Gettysburg Address?</content>
        <answer1>Ipsum Lorem IpsumLorem IpsumLorem Ipsum Lorem IpsumLorem IpsumLorem Ipsum Lorem IpsumLorem IpsumLorem </answer1>
        <answer2>DDDDDDDDDDDDDDDDDDDDDDDDDDDDDDDDDDDDDDDDDDDDDDDDDDDDDDDDDDDDDDDDDDDDDDDDDDDDDDDDDDDDDDDDDDDDDDDDDDDDDDDDDDDDDDD</answer2>
        <answer3>YYYYYYYYYYYYYYYYYYYYYYYYYYYYYYYYYYYYYYYYYYYYYYYYYYYYYYYYYYYYYYYYYYYYYYYYYYYYYYYYYYYYYYYYYYYYYYYYYYYYYYYYYY</answer3>
        <answer4>1000</answer4>
        <correctAnswer>1000</correctAnswer>
    </question>

    <question>
        <content>Who delivered the less famous two-hour speech that preceded Abraham Lincoln's two-minute Gettysburg Address?</content>
        <answer1>Ipsum Lorem IpsumLorem IpsumLorem Ipsum Lorem IpsumLorem IpsumLorem Ipsum Lorem IpsumLorem IpsumLorem </answer1>
        <answer2>DDDDDDDDDDDDDDDDDDDDDDDDDDDDDDDDDDDDDDDDDDDDDDDDDDDDDDDDDDDDDDDDDDDDDDDDDDDDDDDDDDDDDDDDDDDDDDDDDDDDDDDDDDDDDDD</answer2>
        <answer3>YYYYYYYYYYYYYYYYYYYYYYYYYYYYYYYYYYYYYYYYYYYYYYYYYYYYYYYYYYYYYYYYYYYYYYYYYYYYYYYYYYYYYYYYYYYYYYYYYYYYYYYYYY</answer3>
        <answer4>1000</answer4>
        <correctAnswer>1000</correctAnswer>
    </question>

    <question>
        <content>Who delivered the less famous two-hour speech that preceded Abraham Lincoln's two-minute Gettysburg Address?</content>
        <answer1>Ipsum Lorem IpsumLorem IpsumLorem Ipsum Lorem IpsumLorem IpsumLorem Ipsum Lorem IpsumLorem IpsumLorem </answer1>
        <answer2>DDDDDDDDDDDDDDDDDDDDDDDDDDDDDDDDDDDDDDDDDDDDDDDDDDDDDDDDDDDDDDDDDDDDDDDDDDDDDDDDDDDDDDDDDDDDDDDDDDDDDDDDDDDDDDD</answer2>
        <answer3>YYYYYYYYYYYYYYYYYYYYYYYYYYYYYYYYYYYYYYYYYYYYYYYYYYYYYYYYYYYYYYYYYYYYYYYYYYYYYYYYYYYYYYYYYYYYYYYYYYYYYYYYYY</answer3>
        <answer4>1000</answer4>
        <correctAnswer>1000</correctAnswer>
    </question>

    <question>
        <content>Who delivered the less famous two-hour speech that preceded Abraham Lincoln's two-minute Gettysburg Address?</content>
        <answer1>Ipsum Lorem IpsumLorem IpsumLorem Ipsum Lorem IpsumLorem IpsumLorem Ipsum Lorem IpsumLorem IpsumLorem </answer1>
        <answer2>DDDDDDDDDDDDDDDDDDDDDDDDDDDDDDDDDDDDDDDDDDDDDDDDDDDDDDDDDDDDDDDDDDDDDDDDDDDDDDDDDDDDDDDDDDDDDDDDDDDDDDDDDDDDDDD</answer2>
        <answer3>YYYYYYYYYYYYYYYYYYYYYYYYYYYYYYYYYYYYYYYYYYYYYYYYYYYYYYYYYYYYYYYYYYYYYYYYYYYYYYYYYYYYYYYYYYYYYYYYYYYYYYYYYY</answer3>
        <answer4>1000</answer4>
        <correctAnswer>1000</correctAnswer>
    </question>
</questions>
